{
  "$schema": "https://json-schema.org/draft/2020-12/schema",
  "$id": "https://speccompass.local/schemas/ui-review-data.schema.json",
  "title": "SpecCompass UI Review Data",
  "type": "object",
  "additionalProperties": false,
  "required": [
    "schema_version",
    "review_type",
    "artifact_path",
    "confirm_strategy",
    "batch_id",
    "project",
    "source_snapshot",
    "modules"
  ],
  "properties": {
    "schema_version": {
      "type": "integer",
      "enum": [1, 2]
    },
    "review_type": {
      "const": "ui"
    },
    "artifact_path": {
      "type": "string",
      "pattern": "ui-review-data\\.json$"
    },
    "confirm_strategy": {
      "type": "string",
      "enum": ["batch", "hybrid", "rolling"]
    },
    "batch_id": {
      "type": "string",
      "minLength": 1
    },
    "project": {
      "type": "object",
      "additionalProperties": false,
      "required": ["name", "feature", "business_overview"],
      "properties": {
        "name": {"type": "string"},
        "feature": {"type": "string"},
        "business_overview": {"type": "string"},
        "review_goal": {"type": "string"}
      }
    },
    "source_snapshot": {
      "type": "array",
      "minItems": 1,
      "items": {
        "type": "object",
        "additionalProperties": false,
        "required": ["path"],
        "properties": {
          "path": {"type": "string"},
          "anchors": {"type": "array", "items": {"type": "string"}},
          "semantic_scope": {"type": "array", "items": {"type": "string"}}
        }
      }
    },
    "modules": {
      "type": "array",
      "minItems": 1,
      "items": {
        "$ref": "#/$defs/module"
      }
    },
    "schema_notes": {
      "type": "array",
      "items": {"type": "string"}
    }
  },
  "$defs": {
    "module": {
      "type": "object",
      "additionalProperties": false,
      "required": ["id", "title", "summary", "screens"],
      "properties": {
        "id": {"type": "string"},
        "title": {"type": "string"},
        "summary": {"type": "string"},
        "review_layer": {
          "type": "string",
          "enum": ["business", "system_arch", "mixed"]
        },
        "must_confirm_total": {"type": "integer", "minimum": 0},
        "screens": {
          "type": "array",
          "items": {"$ref": "#/$defs/review_item"}
        },
        "trace_notes": {
          "type": "array",
          "items": {"type": "string"}
        }
      }
    },
    "review_item": {
      "type": "object",
      "additionalProperties": false,
      "required": [
        "id",
        "title",
        "summary",
        "source_path",
        "item_type",
        "business_context",
        "primary_users",
        "entry_scenarios",
        "user_goal",
        "user_outcome",
        "flow_refs",
        "screen_layout",
        "screen_regions",
        "nodes"
      ],
      "properties": {
        "id": {"type": "string"},
        "title": {"type": "string"},
        "summary": {"type": "string"},
        "source_path": {"type": "string"},
        "item_type": {
          "type": "string",
          "enum": ["screen", "screen_map", "prototype", "form", "state", "index"]
        },
        "business_context": {
          "type": "string",
          "minLength": 18
        },
        "primary_users": {
          "type": "array",
          "minItems": 1,
          "items": {"type": "string", "minLength": 1}
        },
        "entry_scenarios": {
          "type": "array",
          "minItems": 1,
          "items": {"type": "string", "minLength": 8}
        },
        "user_goal": {
          "type": "string",
          "minLength": 18
        },
        "user_outcome": {
          "type": "string",
          "minLength": 18
        },
        "flow_refs": {
          "type": "array",
          "minItems": 1,
          "items": {"type": "string", "minLength": 1}
        },
        "screen_layout": {
          "type": "string",
          "enum": [
            "dashboard",
            "form",
            "list_detail",
            "wizard",
            "detail",
            "settings",
            "screen_map",
            "modal",
            "custom"
          ]
        },
        "preview_viewport": {
          "type": "string",
          "enum": ["desktop", "tablet", "mobile"]
        },
        "screen_regions": {
          "type": "array",
          "minItems": 1,
          "items": {"$ref": "#/$defs/screen_region"}
        },
        "states": {
          "type": "array",
          "items": {"$ref": "#/$defs/ui_state"}
        },
        "framework_approximation": {"type": "string"},
        "framework_notes": {
          "type": "array",
          "items": {"type": "string"}
        },
        "complex_flow_exception": {"type": "string"},
        "low_risk_linear_exception": {"type": "string"},
        "nodes": {
          "type": "array",
          "items": {"$ref": "#/$defs/node"}
        },
        "edges": {
          "type": "array",
          "items": {"$ref": "#/$defs/edge"}
        },
        "trace_notes": {
          "type": "array",
          "items": {"type": "string"}
        }
      }
    },
    "screen_region": {
      "type": "object",
      "additionalProperties": false,
      "required": ["id", "title", "purpose", "position", "source_ref", "components"],
      "properties": {
        "id": {"type": "string", "minLength": 1},
        "title": {"type": "string", "minLength": 1},
        "purpose": {"type": "string", "minLength": 1},
        "position": {
          "type": "string",
          "enum": ["top", "left", "main", "right", "bottom", "modal", "drawer", "inline"]
        },
        "source_ref": {"type": "string", "minLength": 1},
        "components": {
          "type": "array",
          "minItems": 1,
          "items": {"$ref": "#/$defs/ui_component"}
        },
        "notes": {
          "type": "array",
          "items": {"type": "string"}
        }
      }
    },
    "ui_component": {
      "type": "object",
      "additionalProperties": false,
      "required": ["id", "kind", "label", "purpose", "source_ref"],
      "properties": {
        "id": {"type": "string", "minLength": 1},
        "kind": {
          "type": "string",
          "enum": [
            "button",
            "input",
            "select",
            "textarea",
            "checkbox",
            "radio",
            "table",
            "card",
            "nav",
            "tab",
            "filter",
            "search",
            "badge",
            "chart-note",
            "modal-note",
            "dynamic-marker",
            "text",
            "empty-state",
            "error-note"
          ]
        },
        "label": {"type": "string", "minLength": 1},
        "purpose": {"type": "string", "minLength": 1},
        "source_ref": {"type": "string", "minLength": 1},
        "action_ref": {"type": "string"},
        "field_ref": {"type": "string"},
        "state_ref": {"type": "string"},
        "decision_node_id": {"type": "string"},
        "future_behavior_note": {"type": "string"},
        "display": {"$ref": "#/$defs/ui_component_display"}
      }
    },
    "ui_component_display": {
      "type": "object",
      "additionalProperties": false,
      "properties": {
        "value": {"type": "string"},
        "placeholder": {"type": "string"},
        "helper_text": {"type": "string"},
        "options": {
          "type": "array",
          "minItems": 1,
          "uniqueItems": true,
          "items": {"type": "string", "minLength": 1}
        },
        "columns": {
          "type": "array",
          "minItems": 1,
          "uniqueItems": true,
          "items": {"type": "string", "minLength": 1}
        },
        "rows": {
          "type": "array",
          "items": {
            "type": "array",
            "minItems": 1,
            "items": {"type": "string"}
          }
        },
        "button_variant": {
          "type": "string",
          "enum": ["primary", "secondary", "danger", "ghost"]
        },
        "badge_tone": {
          "type": "string",
          "enum": ["neutral", "info", "success", "warning", "danger"]
        }
      }
    },
    "ui_state": {
      "type": "object",
      "additionalProperties": false,
      "required": ["id", "label", "state_type", "plain_note", "source_ref"],
      "properties": {
        "id": {"type": "string"},
        "label": {"type": "string"},
        "state_type": {
          "type": "string",
          "enum": ["default", "empty", "loading", "error", "success", "permission", "dynamic_marker"]
        },
        "plain_note": {"type": "string"},
        "source_ref": {"type": "string"},
        "future_behavior_note": {"type": "string"}
      }
    },
    "node": {
      "type": "object",
      "additionalProperties": false,
      "allOf": [
        {
          "if": {
            "properties": {"confirmation_priority": {"const": "critical"}},
            "required": ["confirmation_priority"]
          },
          "then": {"required": ["critical_basis", "priority_reason"]}
        },
        {
          "if": {
            "properties": {
              "review_level": {"const": "must_confirm"}
            },
            "required": ["review_level"]
          },
          "then": {
            "properties": {
              "options": {
                "type": "array",
                "minItems": 3,
                "maxItems": 4
              }
            }
          }
        },
        {
          "if": {
            "properties": {
              "options": {
                "type": "array",
                "minItems": 2,
                "maxItems": 2
              }
            },
            "required": ["options"]
          },
          "then": {
            "required": ["options_count_rationale"],
            "properties": {
              "options_count_rationale": {
                "type": "string",
                "minLength": 18
              }
            }
          }
        },
        {
          "if": {
            "required": ["options"]
          },
          "then": {
            "required": ["decision_background", "decision_summary"]
          }
        }
      ],
      "required": [
        "id",
        "label",
        "plain_summary",
        "review_layer",
        "review_level",
        "owner",
        "node_kind",
        "source_ref"
      ],
      "properties": {
        "id": {"type": "string"},
        "label": {"type": "string"},
        "plain_summary": {"type": "string"},
        "decision_background": {"type": "string"},
        "decision_summary": {"type": "string"},
        "action_prompt": {"type": "string"},
        "review_layer": {
          "type": "string",
          "enum": ["business", "system_arch"]
        },
        "review_level": {
          "type": "string",
          "enum": [
            "must_confirm",
            "recommended",
            "uncertain",
            "key_step",
            "verified",
            "system_arch"
          ]
        },
        "confirmation_priority": {
          "type": "string",
          "enum": ["critical", "important", "normal"]
        },
        "priority_reason": {"type": "string", "minLength": 18},
        "critical_basis": {"type": "string", "minLength": 18},
        "owner": {"type": "string"},
        "node_kind": {
          "type": "string",
          "enum": [
            "human_judgment",
            "flow",
            "decision",
            "error",
            "state",
            "ui",
            "system",
            "external",
            "role",
            "sequence"
          ]
        },
        "source_ref": {"type": "string"},
        "options_count_rationale": {"type": "string", "minLength": 18},
        "options": {
          "type": "array",
          "minItems": 2,
          "maxItems": 4,
          "items": {"$ref": "#/$defs/option"}
        },
        "recommended_option": {"type": "string"}
      }
    },
    "option": {
      "type": "object",
      "additionalProperties": false,
      "required": ["id", "label", "benefit", "cost", "consequence", "next_exit"],
      "allOf": [
        {
          "if": {
            "properties": {
              "id": {"const": "OPTION_B"}
            },
            "required": ["id"]
          },
          "then": {
            "properties": {
              "next_exit": {"pattern": "^needs-decision"}
            }
          }
        }
      ],
      "properties": {
        "id": {
          "type": "string",
          "enum": ["OPTION_A", "OPTION_B", "OPTION_C", "OPTION_D"]
        },
        "label": {"type": "string"},
        "benefit": {"type": "string"},
        "cost": {"type": "string"},
        "recommendation_reason": {"type": "string"},
        "when_to_choose": {"type": "string"},
        "consequence": {"type": "string"},
        "project_impact": {"type": "string"},
        "next_exit": {
          "type": "string",
          "description": "OPTION_B.next_exit must start with 'needs-decision'. Other options should provide a concrete continuation route."
        },
        "recommended": {"type": "boolean"}
      }
    },
    "edge": {
      "type": "object",
      "additionalProperties": false,
      "required": ["from", "to"],
      "properties": {
        "from": {"type": "string"},
        "to": {"type": "string"},
        "label": {"type": "string"}
      }
    }
  }
}
