{
  "schema_version": 1,
  "review_type": "ui",
  "artifact_path": "specs/ask-survey/ui/review/ui-review-data.json",
  "confirm_strategy": "batch",
  "batch_id": "ask-survey-ui-2026-06-25",
  "project": {
    "name": "ASK",
    "feature": "问卷与文档协同",
    "business_overview": "ASK UI 示例展示问卷列表、发布抽屉、文档入口和租户状态。确认页重点看页面上是否放对了信息、按钮和提示。",
    "review_goal": "让产品经理能直观看到主要页面长什么样，并确认少数会影响业务结果的界面选择。"
  },
  "source_snapshot": [
    {
      "path": "specs/ask-survey/ui/ui.md",
      "anchors": [
        "问卷列表",
        "发布抽屉",
        "文档入口",
        "租户状态"
      ],
      "semantic_scope": [
        "页面结构",
        "组件用途",
        "界面确认"
      ]
    }
  ],
  "modules": [
    {
      "id": "survey-ui",
      "title": "问卷管理界面",
      "summary": "展示运营每天使用最多的问卷列表和发布操作。审核重点是筛选、发布确认和状态提示是否足够清楚。",
      "review_layer": "business",
      "must_confirm_total": 2,
      "screens": [
        {
          "id": "survey-list-publish-drawer",
          "title": "问卷列表与发布抽屉",
          "summary": "左侧查看问卷列表，右侧在需要时打开发布抽屉。页面把高风险发布动作集中到右侧确认区，避免误操作。",
          "source_path": "specs/ask-survey/ui/survey-list-publish.md",
          "item_type": "screen",
          "business_context": "问卷运营人员每天要在多个草稿和已发布问卷之间切换；正式发布会直接触达填写人，因此需要在不离开列表工作的情况下完成发布前检查。",
          "primary_users": [
            "问卷运营人员",
            "平台管理员"
          ],
          "entry_scenarios": [
            "运营人员进入问卷管理模块，查找草稿、已发布或已关闭的问卷时进入。",
            "问卷内容编辑完成，运营人员准备核对发布范围并执行发布时打开右侧抽屉。"
          ],
          "user_goal": "找到目标问卷，核对标题、目标人群、截止时间和发布风险，并完成发布前确认。",
          "user_outcome": "问卷按确认的范围发布，运营人员回到列表继续查看问卷状态、触达和回收情况。",
          "flow_refs": [
            "specs/ask-survey/flows/survey-publish.mmd#发布前检查",
            "specs/ask-survey/flows/survey-publish.mmd#发布结果"
          ],
          "screen_layout": "list_detail",
          "preview_viewport": "desktop",
          "framework_approximation": "示例使用固定 renderer 近似展示；真实前端可按 PRD 选定框架实现。",
          "framework_notes": [
            "动态数量先用文字标注，不在确认页实现动画或真实计算。",
            "发布抽屉只展示结构和决策点，不模拟完整表单提交。"
          ],
          "screen_regions": [
            {
              "id": "survey-list-top",
              "title": "顶部操作区",
              "purpose": "让运营快速搜索问卷，并创建新的问卷草稿。",
              "position": "top",
              "source_ref": "ui.md#问卷列表顶部",
              "components": [
                {
                  "id": "survey-search",
                  "kind": "search",
                  "label": "搜索问卷名称",
                  "purpose": "按问卷名称快速找到目标问卷。",
                  "source_ref": "ui.md#搜索",
                  "display": {
                    "placeholder": "搜索问卷名称"
                  }
                },
                {
                  "id": "survey-new-button",
                  "kind": "button",
                  "label": "新建问卷",
                  "purpose": "进入问卷草稿创建流程。",
                  "source_ref": "ui.md#新建问卷",
                  "display": {
                    "button_variant": "primary"
                  }
                },
                {
                  "id": "survey-tenant-filter",
                  "kind": "filter",
                  "label": "租户筛选",
                  "purpose": "平台管理员可以只看某个租户的问卷。",
                  "source_ref": "ui.md#租户筛选",
                  "decision_node_id": "ui-survey-tenant-filter"
                }
              ]
            },
            {
              "id": "survey-list-main",
              "title": "问卷列表",
              "purpose": "展示问卷名称、状态、回收数量和最近更新时间，帮助运营判断下一步操作。",
              "position": "main",
              "source_ref": "ui.md#问卷表格",
              "components": [
                {
                  "id": "survey-table",
                  "kind": "table",
                  "label": "问卷表格",
                  "purpose": "集中展示草稿、已发布、已关闭等问卷状态。",
                  "source_ref": "ui.md#问卷表格",
                  "display": {
                    "columns": ["问卷名称", "状态", "回收数量", "最近更新"]
                  }
                },
                {
                  "id": "survey-response-count-note",
                  "kind": "dynamic-marker",
                  "label": "回收数量",
                  "purpose": "提示这里未来会显示实时回收数量。",
                  "source_ref": "ui.md#回收数量",
                  "state_ref": "survey-count-dynamic",
                  "future_behavior_note": "此处数字未来会按答卷提交情况自动更新。"
                },
                {
                  "id": "survey-publish-action",
                  "kind": "button",
                  "label": "发布",
                  "purpose": "打开右侧发布抽屉，要求运营完成发布前确认。",
                  "source_ref": "ui.md#发布按钮",
                  "display": {
                    "button_variant": "secondary"
                  },
                  "decision_node_id": "ui-survey-publish-confirmation"
                }
              ]
            },
            {
              "id": "survey-publish-drawer",
              "title": "发布确认抽屉",
              "purpose": "在发布前集中展示检查结果、容易误发布的提醒和最终发布按钮。",
              "position": "right",
              "source_ref": "ui.md#发布抽屉",
              "components": [
                {
                  "id": "publish-check-summary",
                  "kind": "card",
                  "label": "发布前检查",
                  "purpose": "显示题目、回收范围和截止时间是否已填写。",
                  "source_ref": "ui.md#发布前检查",
                  "display": {
                    "helper_text": "题目、回收范围和截止时间"
                  },
                  "decision_node_id": "ui-survey-publish-confirmation"
                },
                {
                  "id": "publish-risk-badge",
                  "kind": "badge",
                  "label": "需重点确认",
                  "purpose": "提醒审核人这是会影响真实用户的高风险操作。",
                  "source_ref": "ui.md#发布风险",
                  "display": {
                    "badge_tone": "danger"
                  }
                },
                {
                  "id": "publish-submit-button",
                  "kind": "button",
                  "label": "确认发布",
                  "purpose": "检查通过后将问卷发布给目标用户。",
                  "source_ref": "ui.md#确认发布",
                  "display": {
                    "button_variant": "primary"
                  },
                  "decision_node_id": "ui-survey-publish-confirmation"
                }
              ],
              "notes": [
                "发布动作不使用复杂弹窗，确认页只展示抽屉结构和必须确认点。"
              ]
            }
          ],
          "states": [
            {
              "id": "survey-list-default",
              "label": "默认状态",
              "state_type": "default",
              "plain_note": "列表展示最近更新的问卷，运营可以搜索、筛选和发布。",
              "source_ref": "ui.md#默认状态"
            },
            {
              "id": "survey-list-empty",
              "label": "暂无问卷",
              "state_type": "empty",
              "plain_note": "没有问卷时显示新建入口，不展示空表格。",
              "source_ref": "ui.md#空态"
            },
            {
              "id": "survey-count-dynamic",
              "label": "回收数量自动更新",
              "state_type": "dynamic_marker",
              "plain_note": "确认页只用文字说明，不实现实时刷新。",
              "source_ref": "ui.md#回收数量",
              "future_behavior_note": "此处数字未来会自动更新。"
            }
          ],
          "nodes": [
            {
              "id": "ui-survey-publish-confirmation",
              "label": "发布前是否必须二次确认",
              "plain_summary": "本轮需要先拍板发布前确认方式，否则页面布局、开发和验收会按猜测推进，可能增加误发布风险。",
              "action_prompt": "请选择发布前界面应该如何确认。",
              "review_layer": "business",
              "review_level": "must_confirm",
              "owner": "产品经理",
              "node_kind": "human_judgment",
              "source_ref": "ui.md#发布抽屉",
              "recommended_option": "OPTION_A",
              "options": [
                {
                  "id": "OPTION_A",
                  "label": "用右侧发布抽屉展示检查结果，再让运营确认发布",
                  "consequence": "UI 规划模型保留列表页，并把发布抽屉设计成检查摘要、发布前提醒和最终发布按钮三块内容。",
                  "next_exit": "continue: 按发布抽屉继续设计",
                  "recommended": true,
                  "benefit": "运营可以在列表工作流里看完检查摘要再发布，误点发布的风险降低，也不需要离开当前列表。",
                  "cost": "界面比直接发布多一步，但误操作风险低，验收时可以清楚检查抽屉里的信息是否完整。",
                  "recommendation_reason": "推荐这条路，因为抽屉能在列表工作流里完成风险检查，比直接弹确认更清楚，也比独立页面少一次跳转。"
                },
                {
                  "id": "OPTION_B",
                  "label": "先补发布前要展示的信息，再决定抽屉或页面",
                  "consequence": "UI 规划模型先暂停发布确认界面定稿，产品经理补齐发布前信息和确认文案后再继续。",
                  "next_exit": "needs-decision: 补充发布确认信息清单",
                  "benefit": "产品经理能先定清发布前必须展示的信息，避免 UI 先做成抽屉后又因为信息太多改成独立页面。",
                  "cost": "会延后发布界面开发，但能避免先做抽屉后发现信息太多又改成页面。 在产品经理补充决定前，相关流程、界面或开发任务会暂停，排期需要预留这次确认时间。"
                },
                {
                  "id": "OPTION_C",
                  "label": "改成独立发布确认页，适合发布前要填写更多信息",
                  "consequence": "UI 规划模型把发布动作从抽屉改成独立页面，并把检查结果、补充字段和确认按钮按步骤排布。",
                  "next_exit": "revise-local-and-continue: 改为独立发布确认页",
                  "benefit": "发布前信息能放得更完整，目标人群、通知方式、发布时间等补充内容可以按步骤展示。",
                  "cost": "页面更清楚但操作路径更长，开发要多做一个页面，产品也要验收从列表跳转再返回的体验。"
                },
                {
                  "id": "OPTION_D",
                  "label": "只保留轻量二次确认，不展示完整检查摘要",
                  "consequence": "UI 规划模型把抽屉缩小为简单确认区域，只显示问卷名称、发布对象摘要和确认按钮。",
                  "next_exit": "revise-local-and-continue: 简化为轻量发布确认",
                  "benefit": "界面和开发范围最轻，运营只做最终确认，基础发布体验可以更快完成。",
                  "cost": "界面开发更快，但用户看不到完整风险清单，测试要确保后台拦截和错误提示足够可靠。 这种做法更快，但会把一部分风险交给运营培训、人工检查或后续补充测试。"
                }
              ],
              "decision_background": "发布按钮会把问卷推给真实用户，页面必须让运营在点下最终发布前看清检查结果和风险。确认方式太轻会增加误发布，太重会拖慢日常操作。",
              "decision_summary": "请决定发布前确认放在右侧抽屉、独立页面，还是做成更轻的确认方式。"
            },
            {
              "id": "ui-survey-tenant-filter",
              "label": "列表是否显示租户筛选",
              "plain_summary": "平台管理员可能同时管理多个租户，需要决定筛选是否直接出现在列表顶部。",
              "action_prompt": "请选择租户筛选的展示策略。",